{"attr_bonus_data":{"atk":{"base":[{"percent":0,"type_id":1,"type_name":"学习力","value":0},{"percent":0,"type_id":2,"type_name":"刻印","value":115},{"percent":0,"type_id":3,"type_name":"战队加成","value":0},{"percent":0,"type_id":4,"type_name":"称号加成","value":0},{"percent":0,"type_id":5,"type_name":"年费加成","value":10},{"percent":0,"type_id":6,"type_name":"道具加成","value":0},{"percent":0,"type_id":7,"type_name":"专属特性","value":0},{"percent":0,"type_id":8,"type_name":"装扮加成","value":30},{"percent":0,"type_id":9,"type_name":"超能加成","value":0},{"percent":0,"type_id":10,"type_name":"神谕觉醒","value":0},{"percent":0,"type_id":11,"type_name":"特殊加成","value":0}],"base_total":451,"pve":[{"percent":0,"type_id":1,"type_name":"学习力","value":0},{"percent":0,"type_id":2,"type_name":"刻印","value":0},{"percent":0,"type_id":3,"type_name":"战队加成","value":0},{"percent":0,"type_id":4,"type_name":"称号加成","value":0},{"percent":0,"type_id":5,"type_name":"年费加成","value":0},{"percent":0,"type_id":6,"type_name":"道具加成","value":0},{"percent":0,"type_id":7,"type_name":"专属特性","value":0},{"percent":0,"type_id":8,"type_name":"装扮加成","value":0},{"percent":0,"type_id":9,"type_name":"超能加成","value":0},{"percent":0,"type_id":10,"type_name":"神谕觉醒","value":0},{"percent":0,"type_id":11,"type_name":"特殊加成","value":0}],"pve_total":451,"pvp":[{"percent":0,"type_id":1,"type_name":"学习力","value":0},{"percent":0,"type_id":2,"type_name":"刻印","value":0},{"percent":0,"type_id":3,"type_name":"战队加成","value":0},{"percent":0,"type_id":4,"type_name":"称号加成","value":0},{"percent":0,"type_id":5,"type_name":"年费加成","value":0},{"percent":0,"type_id":6,"type_name":"道具加成","value":0},{"percent":0,"type_id":7,"type_name":"专属特性","value":0},{"percent":10,"type_id":8,"type_name":"装扮加成","value":0},{"percent":0,"type_id":9,"type_name":"超能加成","value":0},{"percent":0,"type_id":10,"type_name":"神谕觉醒","value":0},{"percent":0,"type_id":11,"type_name":"特殊加成","value":0}],"pvp_total":496},"def":{"base":[{"percent":0,"type_id":1,"type_name":"学习力","value":0},{"percent":0,"type_id":2,"type_name":"刻印","value":77},{"percent":0,"type_id":3,"type_name":"战队加成","value":0},{"percent":0,"type_id":4,"type_name":"称号加成","value":25},{"percent":0,"type_id":5,"type_name":"年费加成","value":10},{"percent":0,"type_id":6,"type_name":"道具加成","value":0},{"percent":0,"type_id":7,"type_name":"专属特性","value":0},{"percent":0,"type_id":8,"type_name":"装扮加成","value":0},{"percent":0,"type_id":9,"type_name":"超能加成","value":0},{"percent":0,"type_id":10,"type_name":"神谕觉醒","value":0},{"percent":0,"type_id":11,"type_name":"特殊加成","value":0}],"base_total":348,"pve":[{"percent":0,"type_id":1,"type_name":"学习力","value":0},{"percent":0,"type_id":2,"type_name":"刻印","value":0},{"percent":0,"type_id":3,"type_name":"战队加成","value":0},{"percent":0,"type_id":4,"type_name":"称号加成","value":0},{"percent":0,"type_id":5,"type_name":"年费加成","value":0},{"percent":0,"type_id":6,"type_name":"道具加成","value":0},{"percent":0,"type_id":7,"type_name":"专属特性","value":0},{"percent":0,"type_id":8,"type_name":"装扮加成","value":0},{"percent":0,"type_id":9,"type_name":"超能加成","value":0},{"percent":0,"type_id":10,"type_name":"神谕觉醒","value":0},{"percent":0,"type_id":11,"type_name":"特殊加成","value":0}],"pve_total":348,"pvp":[{"percent":0,"type_id":1,"type_name":"学习力","value":0},{"percent":0,"type_id":2,"type_name":"刻印","value":0},{"percent":0,"type_id":3,"type_name":"战队加成","value":0},{"percent":0,"type_id":4,"type_name":"称号加成","value":0},{"percent":0,"type_id":5,"type_name":"年费加成","value":0},{"percent":0,"type_id":6,"type_name":"道具加成","value":0},{"percent":0,"type_id":7,"type_name":"专属特性","value":0},{"percent":10,"type_id":8,"type_name":"装扮加成","value":0},{"percent":0,"type_id":9,"type_name":"超能加成","value":0},{"percent":0,"type_id":10,"type_name":"神谕觉醒","value":0},{"percent":0,"type_id":11,"type_name":"特殊加成","value":0}],"pvp_total":382},"hp":{"base":[{"percent":0,"type_id":1,"type_name":"学习力","value":63},{"percent":0,"type_id":2,"type_name":"刻印","value":234},{"percent":0,"type_id":3,"type_name":"战队加成","value":30},{"percent":0,"type_id":4,"type_name":"称号加成","value":100},{"percent":0,"type_id":5,"type_name":"年费加成","value":10},{"percent":0,"type_id":6,"type_name":"道具加成","value":0},{"percent":0,"type_id":7,"type_name":"专属特性","value":156},{"percent":0,"type_id":8,"type_name":"装扮加成","value":40},{"percent":0,"type_id":9,"type_name":"超能加成","value":0},{"percent":0,"type_id":10,"type_name":"神谕觉醒","value":0},{"percent":0,"type_id":11,"type_name":"特殊加成","value":0}],"base_total":1054,"pve":[{"percent":0,"type_id":1,"type_name":"学习力","value":0},{"percent":0,"type_id":2,"type_name":"刻印","value":0},{"percent":0,"type_id":3,"type_name":"战队加成","value":0},{"percent":0,"type_id":4,"type_name":"称号加成","value":0},{"percent":0,"type_id":5,"type_name":"年费加成","value":0},{"percent":0,"type_id":6,"type_name":"道具加成","value":0},{"percent":0,"type_id":7,"type_name":"专属特性","value":0},{"percent":0,"type_id":8,"type_name":"装扮加成","value":0},{"percent":0,"type_id":9,"type_name":"超能加成","value":0},{"percent":0,"type_id":10,"type_name":"神谕觉醒","value":0},{"percent":0,"type_id":11,"type_name":"特殊加成","value":0}],"pve_total":1054,"pvp":[{"percent":0,"type_id":1,"type_name":"学习力","value":0},{"percent":0,"type_id":2,"type_name":"刻印","value":0},{"percent":0,"type_id":3,"type_name":"战队加成","value":0},{"percent":0,"type_id":4,"type_name":"称号加成","value":0},{"percent":0,"type_id":5,"type_name":"年费加成","value":0},{"percent":0,"type_id":6,"type_name":"道具加成","value":0},{"percent":0,"type_id":7,"type_name":"专属特性","value":0},{"percent":10,"type_id":8,"type_name":"装扮加成","value":0},{"percent":0,"type_id":9,"type_name":"超能加成","value":0},{"percent":0,"type_id":10,"type_name":"神谕觉醒","value":0},{"percent":0,"type_id":11,"type_name":"特殊加成","value":0}],"pvp_total":1159},"sp_atk":{"base":[{"percent":0,"type_id":1,"type_name":"学习力","value":0},{"percent":0,"type_id":2,"type_name":"刻印","value":0},{"percent":0,"type_id":3,"type_name":"战队加成","value":0},{"percent":0,"type_id":4,"type_name":"称号加成","value":0},{"percent":0,"type_id":5,"type_name":"年费加成","value":10},{"percent":0,"type_id":6,"type_name":"道具加成","value":0},{"percent":0,"type_id":7,"type_name":"专属特性","value":0},{"percent":0,"type_id":8,"type_name":"装扮加成","value":30},{"percent":0,"type_id":9,"type_name":"超能加成","value":0},{"percent":0,"type_id":10,"type_name":"神谕觉醒","value":0},{"percent":0,"type_id":11,"type_name":"特殊加成","value":0}],"base_total":216,"pve":[{"percent":0,"type_id":1,"type_name":"学习力","value":0},{"percent":0,"type_id":2,"type_name":"刻印","value":0},{"percent":0,"type_id":3,"type_name":"战队加成","value":0},{"percent":0,"type_id":4,"type_name":"称号加成","value":0},{"percent":0,"type_id":5,"type_name":"年费加成","value":0},{"percent":0,"type_id":6,"type_name":"道具加成","value":0},{"percent":0,"type_id":7,"type_name":"专属特性","value":0},{"percent":0,"type_id":8,"type_name":"装扮加成","value":0},{"percent":0,"type_id":9,"type_name":"超能加成","value":0},{"percent":0,"type_id":10,"type_name":"神谕觉醒","value":0},{"percent":0,"type_id":11,"type_name":"特殊加成","value":0}],"pve_total":216,"pvp":[{"percent":0,"type_id":1,"type_name":"学习力","value":0},{"percent":0,"type_id":2,"type_name":"刻印","value":0},{"percent":0,"type_id":3,"type_name":"战队加成","value":0},{"percent":0,"type_id":4,"type_name":"称号加成","value":0},{"percent":0,"type_id":5,"type_name":"年费加成","value":0},{"percent":0,"type_id":6,"type_name":"道具加成","value":0},{"percent":0,"type_id":7,"type_name":"专属特性","value":0},{"percent":10,"type_id":8,"type_name":"装扮加成","value":0},{"percent":0,"type_id":9,"type_name":"超能加成","value":0},{"percent":0,"type_id":10,"type_name":"神谕觉醒","value":0},{"percent":0,"type_id":11,"type_name":"特殊加成","value":0}],"pvp_total":237},"sp_def":{"base":[{"percent":0,"type_id":1,"type_name":"学习力","value":0},{"percent":0,"type_id":2,"type_name":"刻印","value":77},{"percent":0,"type_id":3,"type_name":"战队加成","value":0},{"percent":0,"type_id":4,"type_name":"称号加成","value":25},{"percent":0,"type_id":5,"type_name":"年费加成","value":10},{"percent":0,"type_id":6,"type_name":"道具加成","value":0},{"percent":0,"type_id":7,"type_name":"专属特性","value":0},{"percent":0,"type_id":8,"type_name":"装扮加成","value":0},{"percent":0,"type_id":9,"type_name":"超能加成","value":0},{"percent":0,"type_id":10,"type_name":"神谕觉醒","value":0},{"percent":0,"type_id":11,"type_name":"特殊加成","value":0}],"base_total":348,"pve":[{"percent":0,"type_id":1,"type_name":"学习力","value":0},{"percent":0,"type_id":2,"type_name":"刻印","value":0},{"percent":0,"type_id":3,"type_name":"战队加成","value":0},{"percent":0,"type_id":4,"type_name":"称号加成","value":0},{"percent":0,"type_id":5,"type_name":"年费加成","value":0},{"percent":0,"type_id":6,"type_name":"道具加成","value":0},{"percent":0,"type_id":7,"type_name":"专属特性","value":0},{"percent":0,"type_id":8,"type_name":"装扮加成","value":0},{"percent":0,"type_id":9,"type_name":"超能加成","value":0},{"percent":0,"type_id":10,"type_name":"神谕觉醒","value":0},{"percent":0,"type_id":11,"type_name":"特殊加成","value":0}],"pve_total":348,"pvp":[{"percent":0,"type_id":1,"type_name":"学习力","value":0},{"percent":0,"type_id":2,"type_name":"刻印","value":0},{"percent":0,"type_id":3,"type_name":"战队加成","value":0},{"percent":0,"type_id":4,"type_name":"称号加成","value":0},{"percent":0,"type_id":5,"type_name":"年费加成","value":0},{"percent":0,"type_id":6,"type_name":"道具加成","value":0},{"percent":0,"type_id":7,"type_name":"专属特性","value":0},{"percent":10,"type_id":8,"type_name":"装扮加成","value":0},{"percent":0,"type_id":9,"type_name":"超能加成","value":0},{"percent":0,"type_id":10,"type_name":"神谕觉醒","value":0},{"percent":0,"type_id":11,"type_name":"特殊加成","value":0}],"pvp_total":382},"spd":{"base":[{"percent":0,"type_id":1,"type_name":"学习力","value":70},{"percent":0,"type_id":2,"type_name":"刻印","value":86},{"percent":0,"type_id":3,"type_name":"战队加成","value":10},{"percent":0,"type_id":4,"type_name":"称号加成","value":0},{"percent":0,"type_id":5,"type_name":"年费加成","value":10},{"percent":0,"type_id":6,"type_name":"道具加成","value":0},{"percent":0,"type_id":7,"type_name":"专属特性","value":0},{"percent":0,"type_id":8,"type_name":"装扮加成","value":0},{"percent":0,"type_